employee_id,employee_name,department,leave_balance_days,reimbursement_status,missing_reimbursement_docs,project_name,weekly_highlights,deliverables,next_week_plan,risks,onboarding_tasks
E1001,林晨,AI应用平台组,6,差旅报销待补充住宿发票,住宿发票,企业知识库助手,完成RAG知识库迁移和Agent工具改造,完成企业制度文档入库和员工数据查询工具,补充评测问题并优化Prompt约束,部分制度边界需要HR确认,已完成信息安全培训和项目管理平台权限开通
E1002,周雨,数据分析组,3,已通过财务初审,无,经营指标看板,完成周活跃指标口径梳理和数据校验,输出指标口径说明和异常数据清单,推进自动化报表和告警配置,数据源字段仍有历史口径差异,待完成报销系统权限申请
E1003,陈一,后端研发组,9,报销已打款,无,权限中心重构,完成角色权限模型设计和接口联调,提交权限校验中间件和单元测试,进行灰度发布和性能压测,老系统权限数据迁移需谨慎,已完成代码平台和测试环境权限开通
E1004,何安,产品设计组,4,被退回,缺少出差申请单,新员工入职体验优化,完成入职流程访谈和问题归类,输出入职旅程图和流程优化建议,与HR确认试用期目标模板,跨部门流程负责人需要明确,待完成信息安全培训
E1005,许诺,IT支持组,11,无报销记录,无,办公设备工单优化,完成高频故障分类和SLA规则梳理,上线工单标签和优先级规则,补充VPN故障自助排查文档,部分老旧设备库存不足,已完成所有入职待办
